Public Food Key,Name,Description
F000522,"Beef, casserole meat, boneless, chuck, lean, casseroled, no added fat","Cooked beef from the fore portion of the carcase. Browned, simmered in minimal water for 2 hours then drained. Lean muscle meat only, with all possible internal and external separable fat removed after cooking."
F000525,"Beef, casserole meat, boneless, chuck, semi-trimmed, raw",Raw beef from the fore portion of the carcase. Lean muscle meat with internal fat. Majority of external fat removed.
F000524,"Beef, casserole meat, boneless, chuck, semi-trimmed, casseroled","Cooked beef from the fore portion of the carcase.  Browned, simmered in minimal water for 2 hours then drained, without added fat. Lean muscle meat with internal fat. Majority of external fat removed."
F000527,"Beef, casserole meat, boneless, chuck, untrimmed, raw",Raw beef from the fore portion of the carcase. Lean muscle meat with all internal and external fat attached.
F000526,"Beef, casserole meat, boneless, chuck, untrimmed, casseroled, no added fat","Cooked beef from the fore portion of the carcase. Browned, simmered in minimal water for 2 hours then drained, without added fat. Lean muscle meat with all internal and external fat attached."
F000561,"Beef, diced, lean, raw","Raw beef, purchased diced and likely to be from various regions of the carcase. Lean muscle meat only, with all possible internal and external separable fat removed."
F000560,"Beef, diced, lean, dry-fried, no added fat","Cooked beef, purchased diced and likely to be from various regions of the carcase. Fried for 3-5 minutes with no added fat. Lean muscle meat only, with all possible internal and external separable fat removed after cooking."
F000559,"Beef, diced, lean, casseroled, no added fat","Cooked beef, purchased diced and likely to be from various regions of the carcase. Casseroled with no added fat. Lean muscle meat only, with all possible internal and external separable fat removed after cooking."
F000564,"Beef, diced, untrimmed, raw","Raw beef, purchased diced and likely to be from various regions of the carcase. Lean muscle meat with internal and external fat attached."
F000563,"Beef, diced, untrimmed, dry-fried, no added fat","Cooked beef, purchased diced and likely to be from various regions of the carcase. Fried for 3-5 minutes with no added fat. Lean muscle meat with internal and external fat attached."
F000562,"Beef, diced, untrimmed, casseroled, no added fat","Cooked beef, purchased diced and likely to be from various regions of the carcase. Casseroled with no added fat. Lean muscle meat with all internal and external separable fat attached."
F000836,"Beef, steak, boneless, fillet or tenderloin, lean, raw","Raw beef from the midsection of the carcase. Lean muscle meat only, with all possible internal and external separable fat removed."
F000835,"Beef, steak, boneless, fillet or tenderloin, lean, grilled, no added fat","Cooked beef from the midsection of the carcase. Grilled for 6-10 minutes until 'medium' with no added fat. Lean muscle meat only, with all possible internal and external separable fat removed after cooking."
F009781,"Beef, steak, boneless, fillet or tenderloin, semi-trimmed, raw",Raw beef from the midsection of the carcase. Lean muscle meat with internal fat. Majority of external fat removed.
F000837,"Beef, steak, boneless, fillet or tenderloin, semi-trimmed, grilled, no added fat",Cooked beef from the midsection of the carcase. Lean muscle meat with internal fat. Majority of external fat removed.
F000839,"Beef, steak, boneless, fillet or tenderloin, untrimmed, raw",Raw beef from the midsection of the carcase. Lean muscle meat with internal and external fat attached.
F000838,"Beef, steak, boneless, fillet or tenderloin, untrimmed, grilled, no added fat",Cooked beef from the midsection of the carcase. Grilled for 6-10 minutes until 'medium' with no added fat. Lean muscle meat with internal and external fat attached.
F000666,"Beef, mince, lower fat, raw","Raw minced beef supplied with a fat content less than 5%. Commonly includes minced beef labelled as lean, heart smart, five star or ultra fine."
F000667,"Beef, mince, lower fat, stir-fried, no added fat",Minced beef supplied with a fat content less than 5% when raw. Fried with no added fat.
F000665,"Beef, mince, lower fat, casseroled, no added fat","Cooked, beef mince supplied with fat content of around 5%. Cooked by boiling, braising, microwaving, poaching stewing or casseroling with no added fat. Includes mince beef labelled as lean, heart smart, five star, choice or extra lean."
F000678,"Beef, mince, regular fat, raw",Raw minced beef supplied with a fat content between 5-10%.
F000679,"Beef, mince, regular fat, stir-fried, no added fat",Minced beef supplied with a fat content between 5-10% when raw. Fried with no added fat.
F000655,"Beef, mince, higher fat, raw",Raw minced beef supplied with a fat content greater than 10%.
F000656,"Beef, mince, higher fat, stir-fried, no added fat",Minced beef supplied with a fat content greater than 10% when raw. Fried with no added fat.
F000704,"Beef, roasting piece, silverside or topside, lean, raw","Raw beef from the hind portion of the carcase. Lean muscle meat only, with all possible internal and external separable fat removed."
F000705,"Beef, roasting piece, silverside or topside, lean, roasted, no added fat","Raw beef from the hind portion of the carcase. Lean muscle meat only, with all possible internal and external separable fat removed."
F000706,"Beef, roasting piece, silverside or topside, semi-trimmed, raw",Raw beef from the hind portion of the carcase. Lean muscle meat with internal fat. Majority of external fat removed.
F000707,"Beef, roasting piece, silverside or topside, semi-trimmed, roasted, no added fat",Raw beef from the hind portion of the carcase. Lean muscle meat with internal fat. Majority of external fat removed.
F000708,"Beef, roasting piece, silverside or topside, untrimmed, raw",Raw beef from the hind portion of the carcase. Lean muscle meat with internal and external fat attached.
F000709,"Beef, roasting piece, silverside or topside, untrimmed, roasted, no added fat",Raw beef from the hind portion of the carcase. Lean muscle meat with internal and external fat attached.
F000841,"Beef, steak, boneless, round, lean, raw","Raw beef from the hind portion of the carcase. Lean muscle meat only, with all possible internal and external separable fat removed."
F000840,"Beef, steak, boneless, round, lean, grilled, no added fat","Cooked beef from the hind portion of the carcase. Grilled for 6-10 minutes until 'medium' with no added fat. Lean muscle meat only, with all possible internal and external separable fat removed after cooking."
F000843,"Beef, steak, boneless, round, semi-trimmed, raw",Raw beef from the hind portion of the carcase. Lean muscle meat with internal fat. All possible external fat removed.
F000842,"Beef, steak, boneless, round, semi-trimmed, grilled, no added fat",Cooked beef from the hind portion of the carcase. Grilled for 6-10 minutes until 'medium' with no added fat. Lean muscle meat with internal fat. Majority of external fat removed after cooking.
F000845,"Beef, steak, boneless, round, untrimmed, raw",Raw beef from the hind portion of the carcase. Lean muscle meat with internal and external fat attached.
F000844,"Beef, steak, boneless, round, untrimmed, grilled, no added fat",Cooked beef from the hind portion of the carcase. Grilled for 6-10 minutes until 'medium' with no added fat. Lean muscle meat with internal and external fat attached.
F000739,"Beef, rump steak, lean, raw","Raw beef from the hind portion of the carcase. Lean muscle meat only, with all possible internal and external separable fat removed."
F000738,"Beef, rump steak, lean, grilled, no added fat","Cooked beef from the hind portion of the carcase. Grilled for 6-10 minutes until 'medium' with no added fat. Lean muscle meat only, with all possible internal and external separable fat removed after cooking."
F000752,"Beef, rump steak, semi-trimmed, raw",Raw beef from the hind portion of the carcase. Lean muscle meat with internal fat. Majority of external fat removed.
F000751,"Beef, rump steak, semi-trimmed, grilled, no added fat",Cooked beef from the hind portion of the carcase. Grilled for 6-10 minutes until 'medium' with no added fat. Lean muscle meat with internal fat. Majority of external fat removed after cooking.
F000765,"Beef, rump steak, untrimmed, raw",Raw beef from the hind portion of the carcase. Lean muscle meat with internal and external fat attached.
F000764,"Beef, rump steak, untrimmed, grilled, no added fat",Cooked beef from the hind portion of the carcase. Grilled for 6-10 minutes until 'medium' with no added fat. Lean muscle meat with internal and external fat attached.
F000847,"Beef, steak, boneless, scotch fillet, lean, raw","Raw beef from the fore portion of the carcase. Lean muscle meat only, with all possible internal and external separable fat removed."
F000846,"Beef, steak, boneless, scotch fillet, lean, grilled, no added fat","Cooked beef from the fore portion of the carcase. Grilled for 6-10 minutes until 'medium' with no added fat. Lean muscle meat only, with all possible internal and external separable fat removed after cooking."
F000830,"Beef, steak, boneless rump or sirloin, lean, raw",Raw beef from the midsection of the carcase. Lean muscle meat with some inseparable internal fat. Majority of internal and external separable fat removed.
F000829,"Beef, steak, boneless rump or sirloin, lean, grilled, no added fat",Cooked beef from the midsection of the carcase. Grilled for 6-10 minutes until 'medium' with no added fat. Lean muscle meat with some inseparable internal fat. All possible internal and external separable fat removed after cooking.
F000832,"Beef, steak, boneless rump or sirloin, semi-trimmed, raw",Raw beef from the midsection of the carcase. Lean muscle meat with internal fat. Majority of external fat removed.
F000831,"Beef, steak, boneless rump or sirloin, semi-trimmed, grilled, no added fat",Cooked beef from the midsection of the carcase. Grilled for 6-10 minutes until 'medium' with no added fat. Lean muscle meat with internal fat. Majority of external fat removed after cooking.
F000834,"Beef, steak, boneless rump or sirloin, untrimmed, raw",Raw beef from the midsection of the carcase. Lean muscle meat with internal and external fat attached.
F000833,"Beef, steak, boneless rump or sirloin, untrimmed, grilled, no added fat",Cooked beef from the midsection of the carcase. Grilled for 6-10 minutes until 'medium' with no added fat. Lean muscle meat with internal and external fat attached.
F000849,"Beef, steak, boneless, scotch fillet, semi-trimmed, raw",Raw beef from the fore portion of the carcase. Lean muscle meat with internal fat. Majority of external fat removed.
F000848,"Beef, steak, boneless, scotch fillet, semi-trimmed, grilled, no added fat",Cooked beef from the fore portion of the carcase. Grilled for 6-10 minutes until 'medium' with no added fat. Lean muscle meat with internal fat. Majority of external fat removed after cooking.
F000851,"Beef, steak, boneless, scotch fillet, untrimmed, raw",Raw beef from the fore portion of the carcase. Lean muscle meat with internal and external fat attached.
F000850,"Beef, steak, boneless, scotch fillet, untrimmed, grilled, no added fat",Cooked beef from the fore portion of the carcase. Grilled for 6-10 minutes until 'medium' with no added fat. Lean muscle meat with internal and external fat attached.
F000792,"Beef, silverside roast, lean, raw","Raw beef from the hind portion of the carcase. Lean muscle meat only, with all possible internal and external separable fat removed."
F000793,"Beef, silverside roast, lean, roasted, no added fat","Cooked beef from the hind portion of the carcase. Oven baked to an internal temperature of 70 degrees celsius with no added fat. Lean muscle meat only, with all possible internal and external separable fat removed after cooking."
F000795,"Beef, silverside roast, semi-trimmed, raw",Raw beef from the hind portion of the carcase. Lean muscle meat with internal fat. Majority of external fat removed.
F000796,"Beef, silverside roast, semi-trimmed, roasted, no added fat",Cooked beef from the hind portion of the carcase. Oven baked to an internal temperature of 70 degrees celsius with no added fat. Lean muscle meat with internal fat. Majority of external fat removed after cooking.
F000798,"Beef, silverside roast, untrimmed, raw",Raw beef from the hind portion of the carcase. Lean muscle meat with internal and external fat attached.
F000799,"Beef, silverside roast, untrimmed, roasted, no added fat",Cooked beef from the hind portion of the carcase. Oven baked to an internal temperature of 70 degrees celsius with no added fat. Lean muscle meat with internal and external fat attached.
F000810,"Beef, sirloin steak, lean, raw","Raw beef from the midsection of the carcase. Lean muscle meat only, with all possible internal and external separable fat removed."
F000809,"Beef, sirloin steak, lean, grilled, no added fat","Cooked beef from the midsection of the carcase. Grilled for 6-10 minutes until 'medium' with no added fat. Lean muscle meat only, with all possible internal and external separable fat removed after cooking."
F000818,"Beef, sirloin steak, semi-trimmed, raw",Raw beef from the midsection of the carcase. Lean muscle meat with internal fat. Majority of external fat removed.
F000817,"Beef, sirloin steak, semi-trimmed, grilled, no added fat",Cooked beef from the midsection of the carcase. Grilled for 6-10 minutes until 'medium' with no added fat. Lean muscle meat with internal fat. Majority of external fat removed after cooking.
F000825,"Beef, sirloin steak, untrimmed, raw",Raw beef from the midsection of the carcase. Lean muscle meat with internal and external fat attached.
F000824,"Beef, sirloin steak, untrimmed, grilled, no added fat",Cooked beef from the midsection of the carcase. Grilled for 6-10 minutes until 'medium' with no added fat. Lean muscle meat with internal and external fat attached.
F000931,"Beef, stir-fry strips, lean, raw","Raw beef, purchased as strips and likely to be from various regions of the carcase. Lean muscle meat only, with all possible internal and external separable fat removed."
F000929,"Beef, stir-fry strips, lean, dry-fried, no added fat","Cooked beef, purchased diced and likely to be from various regions of the carcase. Fried for 3-5 minutes with no added fat. Lean muscle meat only, with all possible internal and external separable fat removed after cooking."
F000934,"Beef, strips, lean, casseroled, no added fat","Cooked beef, purchased as strips and likely to be from various regions of the carcase. Casseroled with no added fat. Lean muscle meat only, with all possible internal and external separable fat removed after cooking."
F000933,"Beef, stir-fry strips, untrimmed, raw","Raw beef, purchased as strips and likely to be from various regions of the carcase. Lean muscle meat with internal and external fat attached."
F000932,"Beef, stir-fry strips, untrimmed, dry-fried, no added fat","Cooked beef, purchased as strips and likely to be from various regions of the carcase. Fried for 3-5 minutes with no added fat. Lean muscle meat with internal and external fat attached."
F000935,"Beef, strips, untrimmed, casseroled, no added fat","Cooked beef, purchased as strips and likely to be from various regions of the carcase. Casseroled with no added fat. Lean muscle meat with all internal and external separable fat attached."
F000881,"Beef, steak, with bone, T-bone or blade, lean, raw",Raw beef from the fore portion of the carcase. Lean muscle meat with some inseparable internal fat. All possible internal and external separable fat removed.
F000880,"Beef, steak, with bone, T-bone or blade, lean, grilled, no added fat",Cooked beef from the fore portion of the carcase. Grilled for 6-10 minutes until 'medium' with no added fat. Lean muscle meat with some inseparable internal fat. All possible internal and external separable fat removed after cooking.
F000883,"Beef, steak, with bone, T-bone or blade, semi-trimmed, raw",Raw beef from the fore portion of the carcase. Lean muscle meat with internal fat. All possible external fat removed.
F000882,"Beef, steak, with bone, T-bone or blade, semi-trimmed, grilled, no added fat",Cooked beef from the fore portion of the carcase. Grilled for 6-10 minutes until 'medium' with no added fat. Lean muscle meat with internal fat. Majority of external separable fat removed after cooking.
F000885,"Beef, steak, with bone, T-bone or blade, untrimmed, raw",Raw beef from the fore portion of the carcase. Lean muscle meat with internal and external fat attached.
F000884,"Beef, steak, with bone, T-bone or blade, untrimmed, grilled, no added fat",Cooked beef from the fore portion of the carcase. Grilled for 6-10 minutes until 'medium' with no added fat. Lean muscle meat with internal and external fat attached.
F000887,"Beef, steak, with bone, T-bone, lean, raw","Raw beef from the midsection of the carcase. Lean muscle meat only, with all possible internal and external separable fat removed."
F000886,"Beef, steak, with bone, T-bone, lean, grilled, no added fat","Cooked beef from the midsection of the carcase. Grilled for 6-10 minutes until 'medium' with no added fat. Lean muscle meat only, with all possible internal and external separable fat removed after cooking."
F000889,"Beef, steak, with bone, T-bone, semi-trimmed, raw",Raw beef from the midsection of the carcase. Lean muscle meat with internal fat. Majority of external fat removed.
F000888,"Beef, steak, with bone, T-bone, semi-trimmed, grilled, no added fat",Cooked beef from the midsection of the carcase. Grilled for 6-10 minutes until 'medium' with no added fat. Lean muscle meat with internal fat. Majority of external fat removed after cooking.
F000891,"Beef, steak, with bone, T-bone, untrimmed, raw",Raw beef from the midsection of the carcase. Lean muscle meat with internal and external fat attached.
F000890,"Beef, steak, with bone, T-bone, untrimmed, grilled, no added fat",Cooked beef from the midsection of the carcase. Grilled for 6-10 minutes until 'medium' with no added fat. Lean muscle meat with internal and external fat attached.
F000961,"Beef, topside roast, lean, raw","Raw beef from the hind portion of the carcase. Lean muscle meat only, with all possible internal and external separable fat removed."
F000962,"Beef, topside roast, lean, roasted, no added fat","Cooked beef from the hind portion of the carcase. Oven baked to an internal temperature of 70 degrees celsius with no added fat. Lean muscle meat only, with all possible internal and external separable fat removed after cooking."
F000963,"Beef, topside roast, semi-trimmed, raw",Raw beef from the hind portion of the carcase. Lean muscle meat with internal fat. Majority of external fat removed.
F000964,"Beef, topside roast, semi-trimmed, roasted, no added fat",Cooked beef from the hind portion of the carcase. Oven baked to an internal temperature of 70 degrees celsius with no added fat. Lean muscle meat with internal fat. Majority of external fat removed after cooking.
F000966,"Beef, topside roast, untrimmed, raw",Raw beef from the hind portion of the carcase. Lean muscle meat with internal and external fat attached.
F000967,"Beef, topside roast, untrimmed, roasted, no added fat",Cooked beef from the midsection of the carcase. Oven baked to an internal temperature of 70 degrees celsius with no added fat. Lean muscle meat with internal and external fat attached.
F009360,"Veal, all cuts, separable fat, raw",Raw veal fat from various regions of the carcase. Internal and external separable fat only.
F009359,"Veal, all cuts, separable fat, cooked","Cooked internal and external separable fat from 4 different cuts from various regions of the carcase. Oven baked or grilled as purchased, still attached to the lean muscle meat, with no added fat to an internal temperature of 70 degrees celsius or until 'medium', then dissected."
F009361,"Veal, boneless dice or strips, lean, raw","Raw veal, purchased diced or in strips and likely to be from various regions of the carcase. Lean muscle meat with some inseparable internal fat. All possible internal and external separable fat removed."
F009362,"Veal, boneless dice or strips, lean, stir-fried, no added fat","Cooked veal, purchased diced or in strips and likely to be from various regions of the carcase.  Lean muscle meat with some inseparable internal fat. All possible internal and external separable fat removed. Fried for 2-5 minutes with no added fat."
F009363,"Veal, boneless dice or strips, untrimmed, raw","Raw veal, purchased diced or in strips and likely to be from various regions of the carcase. Lean muscle meat with internal and external fat attached."
F009364,"Veal, boneless dice or strips, untrimmed, stir-fried, no added fat","Cooked veal, purchased diced or in strips and likely to be from various regions of the carcase. Lean muscle meat with internal and external fat attached. Fried for 2-5 minutes with no added fat."
F009370,"Veal, cutlet, with bone, lean, raw","Raw veal from the midsection of the carcase. Lean muscle meat only, with all possible internal and external separable fat removed."
F009369,"Veal, cutlet, with bone, lean, grilled, no added fat","Cooked veal from the midsection of the carcase. Grilled for 6-10 minutes until 'medium' with no added fat. Lean muscle meat only, with all possible internal and external separable fat removed after cooking."
F009372,"Veal, cutlet, with bone, semi-trimmed, raw",Raw veal from the midsection of the carcase. Lean muscle meat with some inseparable internal fat. Majority of internal and external separable fat removed.
F009371,"Veal, cutlet, with bone, semi-trimmed, grilled, no added fat",Cooked veal from the midsection of the carcase. Grilled for 6-10 minutes until 'medium' with no added fat. Lean muscle meat with some inseparable internal fat. All possible internal and external separable fat removed after cooking.
F009374,"Veal, cutlet, with bone, untrimmed, raw",Raw veal from the midsection of the carcase. Lean muscle meat with internal and external fat attached.
F009373,"Veal, cutlet, with bone, untrimmed, grilled, no added fat",Cooked veal from the midsection of the carcase. Grilled for 6-10 minutes until 'medium' with no added fat. Lean muscle meat with internal and external fat attached.
F009379,"Veal, diced, lean, raw","Raw veal, purchased diced and likely to be from various regions of the carcase. Lean muscle meat only, with all possible internal and external separable fat removed."
F009380,"Veal, diced, lean, stir-fried, no added fat","Cooked veal, purchased diced and likely to be from various regions of the carcase. Fried for 3-5 minutes with no added fat. Lean muscle meat only, with all possible internal and external separable fat removed after cooking."
F009381,"Veal, diced, untrimmed, raw","Raw veal, purchased diced and likely to be from various regions of the carcase. Lean muscle meat with internal and external fat attached."
F009382,"Veal, diced, untrimmed, stir-fried, no added fat","Cooked veal, purchased diced and likely to be from various regions of the carcase. Fried for 2-5 minutes with no added fat. Lean muscle meat with internal and external fat attached."
F009433,"Veal, steak, boneless, leg, lean, raw","Raw veal from the hind portion of the carcase. Lean muscle meat only, with all possible internal and external separable fat removed."
F009432,"Veal, steak, boneless, leg, lean, grilled, no added fat","Cooked veal from the hind portion of the carcase. Grilled for 6-10 minutes until 'medium' with no added fat. Lean muscle meat only, with all possible internal and external separable fat removed after cooking."
F009435,"Veal, steak, boneless, leg, untrimmed, raw",Raw veal from the hind portion of the carcase. Lean muscle meat with internal and external fat attached.
F009434,"Veal, steak, boneless, leg, untrimmed, grilled, no added fat",Cooked veal from the hind portion of the carcase. Grilled for 6-10 minutes until 'medium' with no added fat. Lean muscle meat with internal and external fat attached.
F009438,"Veal, stir-fry strips, lean, raw","Raw veal, purchased as strips and likely to be from various regions of the carcase. Lean muscle meat only, with all possible internal and external separable fat removed."
F009439,"Veal, stir-fry strips, lean, stir-fried, no added fat","Cooked veal, purchased as strips and likely to be from various regions of the carcase. Fried for 3-5 minutes with no added fat. Lean muscle meat only, with all possible internal and external separable fat removed after cooking."
F009440,"Veal, stir-fry strips, untrimmed, raw","Raw veal, purchased as strips and likely to be from various regions of the carcase. Lean muscle meat with internal and external fat attached."
F009441,"Veal, stir-fry strips, untrimmed, stir-fried, no added fat","Cooked veal, purchased as strips and likely to be from various regions of the carcase. Fried for 3-5 minutes with no added fat. Lean muscle meat with internal and external fat attached."
F004831,"Lamb, all cuts, separable fat, raw",Raw internal and external separable fat from 11 different cuts of lamb from various regions of the carcase.
F004830,"Lamb, all cuts, separable fat, cooked","Cooked internal and external separable fat from 11 different cuts of lamb from various regions of the carcase. Oven baked or grilled as purchased, still attached to the lean muscle meat, with no added fat to an internal temperature of 70 degrees celsius or until 'medium', then dissected."
F004846,"Lamb, boneless, fillet or loin, untrimmed, raw","Raw lamb from the midsection of the carcase. Lean muscle meat only, with all internal and external separable fat."
