Public Food Key,Name,Description
F004789,"Kangaroo, rump, baked, no added fat","Flesh from the rump portion of kangaroo, with all skin removed. Baked with no added fat."
F004787,"Kangaroo, loin fillet, raw","Uncooked flesh from the loin region of kangaroo, with all skin removed."
F004786,"Kangaroo, loin fillet, grilled, no added fat","Flesh from the loin portion of kangaroo, with all skin removed. Baked with no added fat."
F004793,"Kangaroo, tail, raw","Uncooked flesh from the tail portion of an adult small red kangaroo, with all skin removed."
F004792,"Kangaroo, tail, cooked, no added fat","Flesh from the tail portion of an adult small red kangaroo, with all skin removed. Cooked with no added fat."
F006282,"Ostrich, fan fillet, raw",Uncooked meat from ostrich thigh.
F006283,"Ostrich, moon steak, raw",Uncooked meat from ostrich outer thigh muscle.
F006698,"Pigeon (squab), whole, raw","Uncooked meat from whole pigeon carcase, offal and bone removed."
F007601,"Rabbit, farmed, whole, raw","Uncooked meat from whole rabbit carcase, offal and bone removed."
F007602,"Rabbit, flesh, casseroled, no added fat","Flesh portion without offal or skin. Small amounts of external fat may remain but large deposits around organs were removed. Casseroled with water, then drained, no added fat."
F002709,"Chicken, liver, raw",Raw liver of chicken trimmed of external fat and large vessels.
F002708,"Chicken, liver, fried, added butter","Liver of chicken, trimmed of external fat and large vessels, fried in butter until cooked."
F005021,"Lamb, liver, grilled, no added fat","Liver tissue from a lamb, grilled with no added fat."
F000224,"Bacon, middle rasher, separable lean, fried, no added fat","Cured, smoked and cooked pork middle rasher containing salt, sugar, mineral salts, antioxidant, nitrite and water. All internal and external fat of the rasher removed. Cooked by frying with no added fat."
F000228,"Bacon, middle rasher, untrimmed, raw","Cured, smoked and cooked pork middle rasher containing salt, sugar, mineral salts, antioxidant, nitrite and water. All internal and external fat of the rasher maintained."
F000227,"Bacon, middle rasher, untrimmed, fried, no added fat","Cured, smoked and cooked pork middle rasher containing salt, sugar, mineral salts, antioxidant, nitrite and water.  All internal and external fat of the rasher maintained. Fried with no added fat."
F000223,"Bacon, middle rasher, separable fat, fried, no added fat","Cured, smoked and cooked pork middle rasher containing salt, sugar, mineral salts, antioxidant, nitrite and water. Fat portion only. Fried with no added fat."
F000231,"Bacon, shortcut, as purchased without rind, fried, no added fat","Cured, smoked and cooked pork shortcut rasher containing salt, sugar, mineral salts, antioxidant, nitrite and water. Fat portion and rind of rasher removed."
F000544,"Beef, corned, canned","Canned processed meat product containing cooked beef, salt, sugar, sodium nitrite and water."
F001322,"Braised steak & onions, canned","Canned product commonly containing beef steak, onion, cereal, tomato, salt, spice and water."
F002756,"Chicken, processed luncheon meat, low or reduced fat","Processed chicken meat product, with a fat content of approximately 3%, generally sold pre-sliced and intended for use as a sandwich filling. Typical ingredients include chicken, water, soy protein, thickener, salt and sugar."
F004025,"Frankfurt, cooked","Frankfurts sold loose and in vacuum packs, simmered in water, then drained. Commonly contains pork, beef (may also contain mutton and veal), cereal, salt, sugar, spices, soy protein, flavours, preservative, sodium nitrite and water."
F004299,"Ham, leg, lean","Cured leg ham containing pork, starch, salt, mineral salts, sugar, antioxidant, sodium nitrite, spices and water, with all separable fat removed."
F006675,"Pie, steak & kidney, canned","Canned pie product containing vegetables, beef, kidney, salt, spices and tomato paste topped with a puff pastry."
F007459,Prosciutto,"A dry-cured ham that is usually thinly sliced. Uncooked, as purchased including the lean and fat portions."
F008112,"Sausage, beef, raw","Uncooked sausage (thick or thin) commonly containing minced beef, wheat flour, salt, rice flour, mineral salts, preservative, spices, and water."
F008106,"Sausage, beef, fried, no added fat","Sausage (thick or thin) commonly containing minced beef, wheat flour, salt, rice flour, mineral salts, preservative, spices, and water. Sausages pricked and placed in a non-stick fry pan and fried gently, turning frequently for 14 minutes, with no added fat. Sausages drained on absorbent paper after cooking."
F008107,"Sausage, beef, grilled, no added fat","Sausage (thick or thin) commonly containing minced beef, wheat flour, salt, rice flour, mineral salts, preservative, spices, and water. Sausages pricked and grilled under hot grill, turning frequently for 12 minutes, with no added fat."
F008119,"Sausage, chicken, plain, fried, no added fat","Sausage (thick or thin) commonly containing minced chicken, wheat flour, salt, rice flour, mineral salts, preservative, spices, and water. Fried with no added fat."
F008116,"Sausage, chicken, flavoured, fried, no added fat","Sausage (thick or thin) commonly containing minced chicken, wheat flour, salt, rice flour, mineral salts, preservative, spices, and water, with added flavour. Fried with no added fat."
F008126,"Sausage, chorizo, uncooked","Uncooked spicy, fermented manufactured meat, served in thin circular slices. Product contains pork and beef, salt, sugar, spices, sodium nitrate and sodium nitrite."
F008125,"Sausage, chorizo, fried, no added fat","Spicy, fermented manufactured meat. Product contains pork and beef, salt, sugar, spices, sodium nitrate and sodium nitrite. Fried with no added fat."
F008137,"Sausage, lamb, plain, fried, no added fat","Sausage (thick or thin) commonly containing minced lamb, wheat flour, salt, rice flour, mineral salts, preservative, spices, and water. Fried with no added fat."
F008136,"Sausage, lamb, flavoured, fried, no added fat","Sausage (thick or thin) commonly containing minced lamb, wheat flour, salt, rice flour, mineral salts, preservative, spices, and water with added flavours. Fried with no added fat."
F008143,"Sausage, pork, fried, no added fat","Sausage (thick or thin) commonly containing pork, wheat flour, salt, rice flour, mineral salts, preservative, hydrolysed vegetable protein, spices and water. Sausages pricked and placed in a non-stick fry pan and fried gently, turning frequently for 16 minutes, with no added fat. Sausages drained on absorbent paper after cooking."
F008740,"Spam, canned","Manufactured pork product containing chopped pork shoulder, leg ham, salt, sugar, mineral salts, sodium nitrite and water."
F009450,"Sausages & vegetables, canned","Canned vegetable and meat product containing vegetables, broth, sausages (beef and pork), wheat flour, salt, mineral salt, spices, tomato paste, sugar, barley and water."
F009452,"Steak & vegetables, canned","Canned vegetable and meat product containing vegetables, broth, meat, wheat flour, barley, tomato paste, thickener, salt, spices and caramel."
F002983,"Coconut, fresh, mature fruit, flesh","Fresh flesh from inside a mature coconut, not preserved by drying or other techniques."
F002985,"Coconut, fresh, young or immature, flesh","Fresh flesh from inside an immature coconut, not preserved by drying or other techniques."
F002984,"Coconut, fresh, mature, water or juice","The liquid portion from the inside of a mature coconut, not preserved or treated."
F002986,"Coconut, fresh, young or immature, water or juice","The liquid portion from the inside of an immature coconut, not preserved or treated."
F002987,"Coconut, grated & desiccated",Grated or shredded flesh from a mature coconut that has been dried and packaged.
F002982,"Coconut, cream, regular fat","Liquid extract of the flesh of mature coconuts, containing significant levels of fat so that it has a creamy appearance. Supplied canned or in UHT tetrapaks."
F002991,"Coconut, milk, canned, regular fat","Canned liquid extract of the flesh of a mature coconut, generally with added water."
F002990,"Coconut, milk, canned, reduced fat","Canned liquid extract of the flesh of a mature coconut, generally with added water. Formulated to have a lower fat content than most coconut milks."
F006081,"Nut, almond, with skin, raw, unsalted",Raw natural almond kernels with a brown skin and a creamy coloured nut.
F006082,"Nut, almond, with skin, roasted, unsalted","Almond kernels with a brown skin and creamy coloured nut, that have been roasted without added salt."
F006077,"Nut, almond meal",Almond kernel briefly heated in boiling water to remove skin and ground to form a meal.
F006087,"Nut, brazil, raw or blanched, unsalted","Raw long, three sided creamy coloured nut with a dark brown skin, enclosed in a 3 sided, tough, dull brown-grey shell, without added salt. Generally sold without the shell and are usually imported into Australia from South America."
F006088,"Nut, cashew, raw, unsalted","Raw, cream coloured kidney shaped nut without added salt."
F006090,"Nut, cashew, roasted, salted","Cream coloured kidney shaped nut, that have been roasted without added salt."
F006095,"Nut, chestnut, raw, unsalted","Raw large, round, grey-white fleshy nut, pointed at the top, with a thin brown skin inside a smooth, glossy brown, soft shell, without added salt."
F006096,"Nut, chestnut, roasted, unsalted","Large, round, grey-white fleshy nut, pointed at the top, with a thin brown skin inside a smooth, glossy brown, soft shell, that have been roasted on a fire or in an oven without added salt."
F006098,"Nut, hazelnut, raw, unsalted","Raw small, light brown, round nut with point at the top, and a thin brown skin, inside a smooth, hard shell with a rough round area at the base, without added salt."
F006099,"Nut, macadamia, raw, unsalted","Raw light brown, smooth, spherical nut, with a very hard, smooth brown shell, covered with either a smooth or a slightly rough brown husk, without added salt."
F006107,"Nut, peanut, with skin, raw, unsalted","Raw kernels with reddish brown skin produced after removing the shell, without added salt."
F006108,"Nut, peanut, with skin, roasted, with oil, salted","Kernels with reddish brown skin produced after removing the shell, that have been roasted with oil and with added salt. Commonly called Beer Nuts."
F006109,"Nut, peanut, without skin, roasted, with oil, salted","Kernels that have had the reddish brown skin removed, and have been roasted with oil and with added salt."
F006110,"Nut, peanut, without skin, roasted, with oil, unsalted","Kernels that have had the reddish brown skin removed, and have been roasted with oil and without added salt."
F006111,"Nut, pecan, raw, unsalted","Raw elliptical nut with a thin, brown shell, sometimes with a black strip covered by a husk, without added salt."
F006112,"Nut, pine, raw, unsalted","Raw, small cream coloured, soft kernel, which is shed from the woody scales of the mature pine cone when it opens out, without added salt. Generally sold without shell and imported in Australia from China and European countries."
F006113,"Nut, pistachio, raw, unsalted","Raw small green kernel, covered with a thin skin, encased in a smooth, cream coloured, brittle shell which separates from the kernel, without added salt. Shell removed."
F006116,"Nut, walnut, raw, unsalted","Raw walnut kernels, described as either brown (sold for baking purposes) or golden (sold for direct consumption), without added salt. Includes samples originating from China and India."
F008209,"Seed, chia, dried",Small dried oval seed commonly black or white in colour.
F008210,"Seed, linseed or flaxseed",Small black dried ripe seeds from the flax plant.
F008211,"Seed, poppy",Small black kidney-shaped seeds of the opium poppy.
F008212,"Seed, pumpkin, hulled & dried","Edible, green-coloured seed from a pumpkin."
F008215,"Seed, sunflower",Kernels produced by removing the outer shell of the seeds of the sunflower.
F009076,"Tahini, sesame seed pulp",Ground sesame seed pulp.
F009533,"Wattle seed (acacia), ground","Edible seeds of the Acacia species, which have been roasted and ground, as supplied for culinary use."
F000386,"Barramundi, aquacultured, fillet, raw","Uncooked barramundi fillet, produced under aquaculture and imported into Australia."
F000385,"Barramundi, aquacultured, fillet, grilled, no added fat","Barramundi fillet, produced under aquaculture and imported into Australia, that has been grilled with no added fat."
F000387,"Barramundi, aquacultured, fillet, steamed with no added fat","Barramundi fillet, produced under aquaculture and imported into Australia, that has been steamed with no added fat."
F000402,"Bassa, fillet, raw","Uncooked bassa (basa) fillet, produced by aquaculture and imported into Australia."
F000401,"Bassa (basa), fillet, baked, no added fat","Bassa (basa) fillet, produced by aquaculture and imported into Australia, that has been baked with no added fat."
F000403,"Bassa (basa), fillet, steamed, no added fat","Bassa (basa) with or without skin, cooked by boiling, microwaving, steaming or poaching, without added fat."
F001277,"Blue grenadier, flesh, raw",Uncooked blue grenadier (hoki) with or without skin.
F001276,"Blue grenadier, flesh, baked, no added fat","Blue grenadier (hoki) flesh, imported into Australia, that has been baked with no added fat."
F001278,"Blue grenadier, flesh, steamed, no added fat","Blue grenadier (hoki) flesh, imported into Australia, that has been steamed with no added fat."
F001884,"Bream, fillet, raw",Uncooked bream fillet.
F001881,"Bream, fillet, baked, no added fat",Bream fillet that has been baked in foil with no added fat.
F001885,"Bream, fillet, steamed, no added fat",Bream fillet that has been steamed with no added fat.
F003973,"Flathead, flesh, raw","Uncooked flathead flesh from the family Platycephalus including species identified as Sand (P. bassenis), Tiger (P. richardsoni) and Rock (P. laevigatus)."
F003970,"Flathead, flesh, baked, no added fat","Flathead flesh from the family Platycephalus including species identified as Sand (P. bassenis), Tiger (P. richardsoni) and Rock (P. laevigatus), that has been baked with no added fat."
F003974,"Flathead, flesh, steamed, no added fat","Flathead flesh from the family Platycephalus including species identified as Sand (P. bassenis), Tiger (P. richardsoni) and Rock (P. laevigatus), that has been steamed with no added fat."
F004202,"Gemfish, flesh, raw",Uncooked gemfish flesh.
F004201,"Gemfish, flesh, baked, no added fat",Gemfish flesh that has been baked with no added fat.
F004203,"Gemfish, flesh, steamed, no added fat",Gemfish flesh that has been steamed with no added fat.
F004811,"Kingfish, yellowtail, aquacultured, fillet, with skin, raw",Uncooked yellowtail kingfish flesh.
F004810,"Kingfish, yellowtail, aquacultured, fillet, with skin, grilled, no added fat",Yellowtail kingfish flesh with skin which has been cooked by grilling without added fat.
F004812,"Kingfish, yellowtail, aquacultured, fillet, with skin, steamed, no added fat",Yellowtail kingfish flesh with skin which has been cooked by steaming without added fat.
F005268,"Mackerel, raw",Uncooked Spanish mackerel with or without skin.
F005267,"Mackerel, grilled, no added fat","Mackerel, with or without skin, cooked by grilling without added fat."
F005270,"Mackerel, steamed, no added fat","Mackerel, with or without skin, cooked by steaming without any added fat."
F005659,"Milkfish, aquacultured, flesh, raw",Uncooked milkfish produced by aquaculture and imported into Australia.
F005658,"Milkfish, aquacultured, flesh, grilled, no added fat","Milkfish produced by aquaculture and imported into Australia, that has been grilled with no added fat"
F005660,"Milkfish, aquacultured, flesh, steamed, no added fat","Milkfish produced by aquaculture and imported into Australia, that has been steamed without added fat."
F005824,"Morwong, fillet, raw",Uncooked morwong fillet.
F005823,"Morwong, fillet, grilled, no added fat",Morwong fillet that has been grilled with no added fat.
F005825,"Morwong, fillet, steamed, no added fat",Morwong fillet that has been steamed with no added fat.
F005922,"Mullet, yelloweye, fillet, raw",Uncooked yelloweye mullet fillet caught in Australian waters.
F005921,"Mullet, yelloweye, fillet, baked, no added fat","Mullet with or without skin, cooked by baking with no added fat or oil."
F005923,"Mullet, yelloweye, fillet, steamed, no added fat","Yelloweye mullet fillet caught in Australian waters, steamed with no added fat."
F005930,"Mulloway, flesh, raw",Uncooked mulloway flesh.
F005926,"Mulloway, flesh, baked, no added fat","Mulloway with or without skin, cooked by baking with no added fat or oil."
F005932,"Mulloway, flesh, steamed, no added fat",Mulloway flesh that has been steamed with no added fat.
F007827,"Salmon, Atlantic, fillet, raw","Uncooked Atlantic salmon fillet, produced by aquaculture."
F007826,"Salmon, Atlantic, fillet, grilled, no added fat","Atlantic salmon fillet without skin, produced by aquaculture that has been grilled with no added fat."
F007828,"Salmon, Atlantic, fillet, steamed, no added fat","Atlantic salmon fillet without skin, produced by aquaculture that has been steamed with no added fat."
F007849,"Salmon, Pacific King, fillet, skinless, raw","Uncooked pacific king salmon fillet without skin, produced by aquaculture."
F007848,"Salmon, Pacific King, fillet, skinless, grilled, no added fat","Pacific king salmon fillet without skin, produced by aquaculture that has been grilled with no added fat."
F007850,"Salmon, Pacific King, fillet, steamed, no added fat","Pacific King salmon fillet without skin, produced by aquaculture that has been steamed with no added fat."
F007973,"Sardine, Australian, whole, raw",Uncooked Australian sardines.
F007972,"Sardine, Australian, whole, fried, no added fat",Australian sardines that have been fried with no added fat.
F008775,"Sprat, blue, wild caught, flesh, skin & bones, raw","Fish described as Australian sardines but of two species (Sardinops sagax and Spratelloides robustus). Wild harvested, uncooked."
F008774,"Sprat, blue, wild caught, flesh, skin & bones, fried, no added fat","Fish described as Australian sardines but of two species (Sardinops sagax and Spratelloides robustus). Wild harvested, fried with no added fat."
F008237,"Shark, fillet, without skin, raw","Uncooked shark or flake (typically Gummy, School and Black Tipped shark) fillet without skin."
F008236,"Shark, fillet, without skin, baked, no added fat","Shark or flake (typically Gummy, School and Black Tipped shark) fillet without skin that has been baked with no added fat."
F008238,"Shark, fillet, without skin, steamed, no added fat","Shark or flake (typically Gummy, School and Black Tipped shark) fillet without skin that has been steamed with no added fat."
F008233,"Shark, battered, deep-fried, takeaway outlet","Shark or flake fillet without skin, coated in batter and deep fried, purchased ready to eat from a takeaway outlet."
F008263,"Silver perch, aquacultured, raw","Uncooked silver perch fillet, produced in Australia by aquaculture."
F008258,"Silver perch, aquacultured, baked, no added fat","Silver perch fillet, produced in Australia by aquaculture, that has been baked with no added fat."
F008264,"Silver perch, aquacultured, steamed, no added fat","Silver perch fillet, produced in Australia by aquaculture, that has been steamed with no added fat."
F008359,"Snapper, fillet, raw",Uncooked snapper fillet.
F008358,"Snapper, fillet, baked, no added fat",Snapper fillet that has been baked with no added fat.
F008360,"Snapper, fillet, steamed, no added fat",Snapper fillet that has been steamed with no added fat.
F009163,"Tilapia, fillet, raw","Uncooked tilapia fillet, produced by aquaculture and imported into Australia."
F009161,"Tilapia, fillet, baked, no added fat","Tilapia fillet, produced by aquaculture and imported into Australia that has been baked with no added fat."
F009164,"Tilapia, fillet, steamed, no added fat","Tilapia fillet, produced by aquaculture and imported into Australia, that has been steamed with no added fat."
F009268,"Trout, ocean, aquacultured, fillet, without skin, raw","Uncooked ocean trout, produced in Australia by aquaculture."
F009267,"Trout, ocean, aquacultured, fillet, without skin, baked, no added fat","Uncooked ocean trout, produced in Australia by aquaculture that has been backed with no added fat."
F009269,"Trout, ocean, aquacultured, fillet, without skin, steamed, no added fat","Uncooked ocean trout, produced in Australia by aquaculture that has been steamed with no added fat."
F009271,"Trout, rainbow, aquacultured, raw","Uncooked rainbow trout (including some skin), produced in Australia by aquaculture."
F009270,"Trout, rainbow, aquacultured, baked, no added fat","Rainbow trout (including some skin), produced in Australia by aquaculture that has been baked with no added fat."
F009273,"Trout, rainbow, aquacultured, steamed, no added fat","Rainbow trout with or without skin, cooked by steaming, without added fat or oil."
F009303,"Tuna, yellowfin, flesh, raw",Uncooked yellowfin tuna flesh.
F009302,"Tuna, yellowfin, flesh, baked, no added fat","Yellowfin tuna flesh, that has been baked with no added fat or oil."
F009304,"Tuna, yellowfin, flesh, steamed, no added fat","Yellowfin tuna flesh, that has been steamed with no added fat."
F009560,"Whiting, King George, flesh, raw",Uncooked king george whiting flesh
F009557,"Whiting, King George, flesh, baked, no added fat",King george whiting flesh that has been baked with no added fat.
F009561,"Whiting, King George, flesh, steamed, no added fat",King george whiting flesh that has been steamed with no added fat.
F003920,"Fish, eel, raw","Uncooked eel, with or without skin."
F003950,"Fish, white flesh, battered, packaged frozen, baked, no added fat","Fillets of an undefined white fleshed fish, purchased commercially battered and frozen. Baked at home with no added fat."
F003954,"Fish, white flesh, crumbed, packaged frozen, baked, no added fat","Fillets of an undefined white fleshed fish, purchased commercially crumbed and frozen. Baked at home with no added fat."
F003907,"Fish, battered or crumbed, from takeaway outlet, deep fried, blended frying fat, ready to eat","Fillets of an undefined white flesh fish, coated in batter or breadcrumbs, the deep fried in a blended frying fat, as purchased from takeaway food outlets."
F000002,"Abalone, black lip, aquacultured, raw",Uncooked greyish-brown flesh of a single-shelled mollusc which is characterised by a black ring surrounding the flesh. Aquacultured.
F000003,"Abalone, black lip, wild, raw",Uncooked greyish-brown flesh of a single-shelled mollusc which is characterised by a black ring surrounding the flesh. Wild caught.
F000005,"Abalone, green lip, aquacultured, raw",Uncooked greyish-brown flesh of a single-shelled mollusc which is characterised by a green ring surrounding the flesh. Aquacultured.
F000006,"Abalone, green lip, wild, raw",Uncooked greyish-brown flesh of a single-shelled mollusc which is characterised by a green ring surrounding the flesh. Wild caught.
F000004,"Abalone, brown lip, wild, raw",Uncooked greyish-brown flesh of a single-shelled mollusc which is characterised by a brown ring surrounding the flesh. Wild caught.
F003243,"Crab, flesh, purchased steamed or boiled",Flesh from crabs purchased freshly cooked by boiling or steaming.
F005228,"Lobster, southern rock, wild, flesh, raw",Uncooked flesh from lobsters.
F005227,"Lobster, southern rock, wild, flesh, purchased steamed or boiled",Flesh from lobsters cooked whole in water or steam prior to purchase so that the lobster is red in colour.
F005968,"Mussel, blue, steamed","Flesh of a mussel that has a blue or purple tinged shell, that has been steamed with no added fat."
F006150,"Octopus, raw",Uncooked octopus flesh.
F006146,"Octopus, boiled, no added fat",Octopus flesh that has been boiled with no added fat.
F006288,"Oyster, native, aquacultured, raw",Uncooked flesh of aquacultured native oysters purchased in open half shell.
F006289,"Oyster, Pacific, aquacultured, raw",Uncooked flesh of aquacultured Pacific oysters purchased in open half shell.
F006291,"Oyster, Sydney rock, aquacultured, raw",Uncooked flesh of aquacultured Sydney rock oysters purchased in open half shell.
F006285,"Oyster, aquacultured, raw","Uncooked flesh of oysters purchased in open half shell. Includes oysters described as Pacific, Native and Sydney rock oysters."
F007422,"Prawn, banana, wild, flesh, raw","Uncooked flesh from banana prawns, typically pale in colour with a greenish tinge. Wild caught."
F007421,"Prawn, banana, aquacultured, purchased cooked",Flesh from banana prawns. Wild caught and purchased pre-cooked.
F007424,"Prawn, brown tiger, wild, flesh, raw","Uncooked flesh from brown tiger prawns, typically pale brown to blue-green with distinctive stripes. Wild caught."
F007423,"Prawn, black tiger, aquacultured, purchased cooked",Flesh from black tiger prawns. Wild caught and purchased pre-cooked.
F007431,"Prawn, endeavour, wild, flesh, raw","Uncooked flesh from endeavour prawns, typically pale brown to pink in colour. Wild caught."
F007451,"Prawn, school, wild, flesh, raw","Uncooked flesh from school prawns, typically pale in colour with a greenish tinge. Wild caught."
F007454,"Prawn, Western king, wild, flesh, raw","Uncooked flesh from Western king prawns, typically cream to light brown flesh. Wild caught."
F007433,"Prawn, flesh, raw (green)","Uncooked flesh from large prawns, typically pale in colour with a greenish tinge."
F007432,"Prawn, flesh, cooked from raw, no added fat",Flesh from large prawns that have been fried with no added fat.
F008166,"Scallop, raw",Uncooked flesh and roe of a scallop.
